{
  "scenario": {
    "id": "html-generation",
    "version": "1.0.0",
    "definition_digest": "sha256:2ef129bc2277d1927147c533a18bcc5500db43e4c36ef12313b904fe80bb709c"
  },
  "required_capabilities": [
    {
      "id": "agent.general",
      "version": "1.0",
      "profile": "default"
    },
    {
      "id": "html.generate",
      "version": "1.0",
      "profile": "responsive"
    },
    {
      "id": "artifact.preview.html",
      "version": "1.0",
      "profile": "default"
    }
  ],
  "experience_requirements": [
    {
      "kind": "template",
      "capability_id": "template.html.generate",
      "minimum": 1,
      "maximum": 1,
      "required_tags": [
        "landing"
      ]
    }
  ],
  "experience_revisions": [
    {
      "template_revision_id": "tmplrev_01J00000000000000000000000",
      "template_id": "html-anything/landing-saas-dark",
      "version": "1.0.0",
      "revision_digest": "sha256:82add86db0b4716f3205acb89a32f1f44398c9825b5298c7cf58d96ff8300480",
      "provider_revision": {
        "provider_revision_id": "tplpr_01J0000000000000000000000",
        "provider_revision_digest": "sha256:681a713af913b80a3f29ddbaeb2d7c14386d53e5c83d4f2bf6418b8e9a37ed68",
        "provider_kind": "template",
        "implementation": {
          "implementation_id": "template-provider.html-anything",
          "implementation_version": "1.0.0",
          "distribution_type": "static_catalog",
          "distribution_digest": "sha256:8282828282828282828282828282828282828282828282828282828282828282",
          "manifest_digest": "sha256:8181818181818181818181818181818181818181818181818181818181818181",
          "provenance": {
            "source_revision": "fff069561c01646b12e35cc9b75a06e76f805e8e6c1e9e7e5099d3ddaf1d5644",
            "source_tree_digest": "sha256:1020243e50e91b511e76859472575ed5f8e3fe4e6c5ed1a45f37bb5f66b98219",
            "build_artifact_digest": "sha256:8282828282828282828282828282828282828282828282828282828282828282",
            "sbom_digest": "sha256:024bb69402a12a518c4216765c28f889ad0fc10ba6fc837cf1c87fa2900bbaec",
            "provenance_statement_digest": "sha256:267e79f31d8b644a5982b132baf74b780293aa98c209979c52953b6f8bdfc702",
            "build_system": "contract-fixture-build-v1"
          }
        },
        "port": {
          "protocol": "capability-provider",
          "protocol_version": "v1",
          "contract_digest": "sha256:82ab68c671d838e1c3f0e3e31368c985c118120c8c474d21fc648e312ce7d500",
          "binding_digest": "sha256:8585858585858585858585858585858585858585858585858585858585858585"
        },
        "configuration_digest": "sha256:8383838383838383838383838383838383838383838383838383838383838383",
        "approved_permissions_digest": "sha256:8484848484848484848484848484848484848484848484848484848484848484",
        "credential_binding_digest": "sha256:8686868686868686868686868686868686868686868686868686868686868686",
        "conformance_set_digest": "sha256:dfbe87298fa493b48bca81c7c527caf31203d0d3a86c7899bca9629b4c90ce09",
        "admission_decision_id": "tplad_01J0000000000000000000000",
        "admission_decision_digest": "sha256:fc8c956761f4834cc371c9788cca254101c9166428ab129308c15cb2464e865e",
        "admission_status": "certified"
      },
      "capability": {
        "id": "template.html.generate",
        "version": "1.0",
        "profile": "landing-page"
      },
      "source_artifact": {
        "artifact_id": "art_template_landing_saas_dark",
        "version_id": "ver_template_landing_saas_dark_1",
        "digest": "sha256:9191919191919191919191919191919191919191919191919191919191919191",
        "media_type": "application/vnd.agent.skill+zip"
      },
      "preview_artifact": {
        "artifact_id": "art_template_landing_saas_dark_preview",
        "version_id": "ver_template_landing_saas_dark_preview_1"
      },
      "parameter_schema": {
        "uri": "urn:agent-platform:template-schema:landing-saas-dark:v1",
        "digest": "sha256:9292929292929292929292929292929292929292929292929292929292929292",
        "dialect": "https://json-schema.org/draft/2020-12/schema"
      },
      "tags": [
        "landing",
        "saas",
        "dark"
      ],
      "locales": [
        "en",
        "zh-CN"
      ],
      "required_entitlements": [
        "experience.html.premium"
      ],
      "lifecycle": "stable",
      "created_at": "2026-07-15T09:00:00Z"
    }
  ],
  "capability_definitions": [
    {
      "id": "agent.general",
      "version": "1.0",
      "profile": "default",
      "definition_digest": "sha256:3333333333333333333333333333333333333333333333333333333333333333",
      "allowed_provider_kinds": [
        "agent_runtime"
      ]
    },
    {
      "id": "html.generate",
      "version": "1.0",
      "profile": "responsive",
      "definition_digest": "sha256:3434343434343434343434343434343434343434343434343434343434343434",
      "allowed_provider_kinds": [
        "tool",
        "skill"
      ]
    },
    {
      "id": "artifact.preview.html",
      "version": "1.0",
      "profile": "default",
      "definition_digest": "sha256:3535353535353535353535353535353535353535353535353535353535353535",
      "allowed_provider_kinds": [
        "renderer"
      ]
    },
    {
      "id": "sandbox.exec",
      "version": "1.0",
      "profile": "hardened",
      "definition_digest": "sha256:3030303030303030303030303030303030303030303030303030303030303030",
      "allowed_provider_kinds": [
        "sandbox"
      ]
    },
    {
      "id": "agent.runtime.execute",
      "version": "1.0",
      "profile": "governed",
      "definition_digest": "sha256:3232323232323232323232323232323232323232323232323232323232323232",
      "allowed_provider_kinds": [
        "agent_runtime"
      ]
    }
  ],
  "agent_runtime_capability": {
    "id": "agent.runtime.execute",
    "version": "1.0",
    "profile": "governed",
    "definition_digest": "sha256:3232323232323232323232323232323232323232323232323232323232323232",
    "allowed_provider_kinds": [
      "agent_runtime"
    ]
  },
  "provider_revisions": [
    {
      "provider_revision_id": "spr_01J00000000000000000000000",
      "provider_revision_digest": "sha256:76c77ff375ea0363c130a9fea147d1de328b8ba0f2483bb5ee4ac715a6cde16d",
      "provider_instance_id": "spi_native_sandbox",
      "configuration_digest": "sha256:4444444444444444444444444444444444444444444444444444444444444444",
      "approved_permissions_digest": "sha256:5555555555555555555555555555555555555555555555555555555555555555",
      "credential_binding_digest": "sha256:7777777777777777777777777777777777777777777777777777777777777777",
      "provider_kind": "sandbox",
      "conformance": [
        {
          "capability": "sandbox.exec",
          "version": "1.0",
          "profile": "hardened",
          "suite_version": "1.0.0",
          "status": "passed",
          "report_digest": "sha256:8888888888888888888888888888888888888888888888888888888888888888",
          "suite_id": "sandbox-provider",
          "suite_digest": "sha256:fd85653947c27723f6d260087f7d3eff49a2cd31306c3f153675ec79284928a9",
          "suite_profile_id": "sandbox-core-v1"
        }
      ],
      "conformance_set_digest": "sha256:4d8889e6063f7704daeea3dc0f3c2663614def9aa05c622a0a6c0201a2773c89",
      "created_at": "2026-07-16T09:00:00Z",
      "implementation": {
        "implementation_id": "sandbox-provider.native",
        "implementation_version": "0.8.2",
        "distribution_type": "oci_image",
        "distribution_digest": "sha256:2222222222222222222222222222222222222222222222222222222222222222",
        "manifest_digest": "sha256:1111111111111111111111111111111111111111111111111111111111111111",
        "provenance": {
          "source_revision": "9c37e975d779c58140bb5cd9f9b8392b7cbd9e983f3bb5bfa4ea82883f8cd3fc",
          "source_tree_digest": "sha256:8f5c190d225474f8b544d443ddf4c322d8cd81d5a07ed7434bbfd98606b21cbe",
          "build_artifact_digest": "sha256:2222222222222222222222222222222222222222222222222222222222222222",
          "sbom_digest": "sha256:98f6a838792c8dfc83f6eca3151b7c666ab0a04797519905ffdb1f9656bc1d58",
          "provenance_statement_digest": "sha256:31905821d0c07873cd474cddb5cbd6ca9bf8fba00cc62079a8b6bda03a035c12",
          "build_system": "contract-fixture-build-v1"
        },
        "image_digest": "sha256:3333333333333333333333333333333333333333333333333333333333333333"
      },
      "port": {
        "protocol": "sandbox-provider",
        "protocol_version": "v1",
        "contract_digest": "sha256:173feeb61f47696778f1c457f275677fc8e5d287088094d0a3c7129c359cbe95",
        "binding_digest": "sha256:6666666666666666666666666666666666666666666666666666666666666666"
      }
    },
    {
      "provider_revision_id": "apr_01J00000000000000000000000",
      "provider_revision_digest": "sha256:2052a6b7f9fb2ddf13eddf3fcdbfde056187e9cce1ed1f724141c4e0d452ed93",
      "provider_instance_id": "api_native_runtime",
      "configuration_digest": "sha256:eeeeeeeeeeeeeeeeeeeeeeeeeeeeeeeeeeeeeeeeeeeeeeeeeeeeeeeeeeeeeeee",
      "approved_permissions_digest": "sha256:ffffffffffffffffffffffffffffffffffffffffffffffffffffffffffffffff",
      "credential_binding_digest": "sha256:bbbbbbbbbbbbbbbbbbbbbbbbbbbbbbbbbbbbbbbbbbbbbbbbbbbbbbbbbbbbbbbb",
      "provider_kind": "agent_runtime",
      "conformance": [
        {
          "capability": "agent.runtime.execute",
          "version": "1.0",
          "profile": "governed",
          "suite_version": "1.0.0",
          "status": "passed",
          "report_digest": "sha256:1212121212121212121212121212121212121212121212121212121212121212",
          "suite_id": "agent-runtime-provider",
          "suite_digest": "sha256:6bd5bee33974860ca312f94a2eb43cd634ccb9e200b4419d439277546875aa68",
          "suite_profile_id": "governed-v1"
        },
        {
          "capability": "agent.general",
          "version": "1.0",
          "profile": "default",